{
  "evalFrameworkVersion": "1.0.0",
  "scope": "changed-files",
  "retryLimitForSelfRepair": 3,
  "thresholds": {
    "lintErrorsAllowedDelta": 0,
    "typeErrorsAllowed": 0,
    "semgrepFindingsAllowed": { "critical": 0, "high": 0, "medium": 5 },
    "dependencyVulnerabilitiesAllowed": { "critical": 0, "high": 0 },
    "disallowedLicenses": ["GPL-2.0", "GPL-3.0", "AGPL-3.0", "SSPL-1.0"],
    "maxCyclomaticComplexity": 12,
    "secretFindingsAllowed": 0,
    "unitTestCoverageMin": 90.0,
    "behaviorScenarioPassRateMin": 100.0,
    "llmJudgeArchitectureScoreMin": 0.85,
    "llmJudgeSecurityScoreMin": 0.85,
    "securityVulnerabilitiesAllowed": 0
  },
  "behavior": {
    "containerRuntime": "podman",
    "image": "aire-behavior:local",
    "containerfile": "tests/.evals/behavior/Containerfile",
    "entrypoint": "tests/.evals/behavior/run.sh",
    "_comment": "Same image + command locally and in CI. A missing runtime degrades to native execution, recorded, never blocking."
  },
  "sonarqube": {
    "enabled": false,
    "_comment": "Set true when CI generation creates sonar-project.properties and the user answers proceed at the setup gate. Additive to semgrep, never a replacement."
  },
  "playwright": {
    "enabled": true,
    "startCommand": "npm run dev --prefix src/frontend",
    "readinessUrl": "http://127.0.0.1:5173",
    "testCommand": "npx playwright test tests/e2e/",
    "backendStartCommand": "cd src/backend && uvicorn main:app --reload --port 8000",
    "backendReadinessUrl": "http://127.0.0.1:8000/docs",
    "_comment": "Resolved by Story 1.1's Playwright UI Automation Gate (dev-implement Step 6.7) — the first work unit to run this gate for real."
  },
  "judge": { "model": "claude-sonnet-5", "rubricVersion": "1.0.0" },
  "ci": {
    "baseBranch": "main",
    "integrationBranchPrefixes": ["epic", "bug", "enh", "ci", "story", "ve"],
    "manifestState": "resolved",
    "roots": [
      {
        "root": "src/backend",
        "stack": "python",
        "runtimeVersion": "3.11",
        "markerFile": "requirements.txt",
        "installCommands": ["pip install -r requirements.txt"],
        "buildCommand": null,
        "coverageCommand": "pytest --cov=. --cov-report=xml",
        "noTestsExitCode": 5,
        "dependsOn": [],
        "toolchainSetup": [],
        "coverageReportPath": "coverage.xml",
        "coverageFormat": "cobertura",
        "sourcePaths": ["src/backend"],
        "testPaths": ["tests/unit/backend"],
        "tools": ["semgrep", "pip-audit", "gitleaks"],
        "toolInstallCommands": {
          "semgrep": "pip install \"semgrep==1.127.0\"",
          "pip-audit": "pip install \"pip-audit==2.9.0\"",
          "gitleaks": "gitleaks_version=8.21.2; curl -sSfL \"https://github.com/gitleaks/gitleaks/releases/download/v${gitleaks_version}/gitleaks_${gitleaks_version}_linux_x64.tar.gz\" | tar xz -C /usr/local/bin gitleaks"
        }
      },
      {
        "root": "src/frontend",
        "stack": "node",
        "runtimeVersion": "22.14.0",
        "markerFile": "package.json",
        "installCommands": ["npm ci"],
        "buildCommand": "npm run build",
        "coverageCommand": "npx vitest run --coverage",
        "dependsOn": [],
        "toolchainSetup": [],
        "coverageReportPath": "coverage/lcov.info",
        "coverageFormat": "lcov",
        "sourcePaths": ["src/frontend/src"],
        "testPaths": ["tests/unit/frontend"],
        "tools": ["semgrep", "gitleaks"],
        "toolInstallCommands": {
          "semgrep": "pip install \"semgrep==1.127.0\"",
          "gitleaks": "gitleaks_version=8.21.2; curl -sSfL \"https://github.com/gitleaks/gitleaks/releases/download/v${gitleaks_version}/gitleaks_${gitleaks_version}_linux_x64.tar.gz\" | tar xz -C /usr/local/bin gitleaks"
        }
      }
    ],
    "gates": ["D1_lint", "D2_types", "D3_sast", "D4_deps", "D5_licenses", "D6_complexity", "D7_secrets",
              "unitCoverage", "behaviorB1", "behaviorB2", "behaviorB3", "J1_architecture", "J2_security"],
    "_gatesComment": "D2_types is N/A for src/frontend (plain JS/JSX, no TypeScript configured in this project) and applicable for src/backend via mypy once bootstrapped.",
    "_rootsComment": "noTestsExitCode is the exit status THIS root's test runner returns when it collects ZERO tests (pytest 5; vitest/jest prefer --passWithNoTests instead). Neither root has a test suite yet (greenfield-within-brownfield for testing) — this is the correct state before Story 1.1/1.2 add the first tests, not something to self-repair by writing dummy tests.",
    "_comment": "CI SINGLE SOURCE OF TRUTH, even though the CI/CD pipeline YAML itself was declined by the user at the STOP CHECKPOINT (## CI/CD Configuration: Enabled: No) — local gates during dev-implement still read this block."
  }
}
